{"run_id":"CPR-RUN-EXAMPLE-001","chapter_id":"CH-EXAMPLE","volume_id":"VOL-EXAMPLE","chapter_version":"v1","stage":"intake","trigger":"new_chapter_intake","specification_id":"MWM-CPR-SPEC","rule_version":"0.1.0","profile_id":"MWM-CP-EXAMPLE","profile_version":"0.1.0","publisher_profile":null,"upstream_statuses":[{"skill_id":"RCI","run_id":"RCI-RUN-EXAMPLE","status":"not_run","not_run_reason":"intake","finding_ids":[],"owner":"RCI owner","severity":null,"release_effect":"track","response_status":"not_required","evidence_locator":null}],"protected_record_policy":"identifiers and approved locators only","signatory_role":"volume editor","reviewer":"CPR reviewer","tool_policy":"approved local parsing","prior_run_id":null,"started_at":"2026-08-13T00:00:00Z"}
